{
  "schemaVersion": 1,
  "id": "TASK-0007",
  "type": "feature",
  "risk": "high-risk",
  "status": "reviewing",
  "goal": "Integrate dau-viet-db Flyway migrations V2-V4 into dau-viet-backend (Phase A, done) and implement Authentication & Authorization foundations: register/login/refresh/logout, JWT access tokens, refresh-token rotation with family revocation, roles LEARNER/CONTENT_ADMIN, GET /api/v1/users/me, admin endpoint gating, keeping public Historical Event APIs unauthenticated.",
  "owner": "claude",
  "modules": ["backend"],
  "scope": [
    "dau-viet-backend/",
    "dau-viet-db/",
    "tasks/TASK-0007/",
    "docs/API_SPEC.md",
    "docs/DATABASE_DESIGN.md",
    "docs/backend-runbook.md",
    "plans/2026-10-15-import-dau-viet-db-migrations/",
    "plans/261015-2204-auth-implementation/"
  ],
  "acceptanceCriteria": [
    { "id": "AC-1", "text": "V2/V3/V4 migrations copied verbatim into db/migration, V1 unchanged, dau-viet-db/ kept in repo for provenance." },
    { "id": "AC-2", "text": "Flyway applies V1-V4 on empty Postgres; 13 new tables exist; lesson_versions immutability trigger fires (FlywayMigrationIT)." },
    { "id": "AC-3", "text": "POST /api/v1/auth/register creates a LEARNER account: email normalized lowercase, unique enforced, BCrypt hash only, safe DTO returned, client-supplied role rejected 400, invalid input -> 400." },
    { "id": "AC-4", "text": "POST /api/v1/auth/login returns access+refresh tokens; invalid credentials and LOCKED/DISABLED accounts -> uniform 401 INVALID_CREDENTIALS without account-existence leak." },
    { "id": "AC-5", "text": "POST /api/v1/auth/refresh rotates tokens: old token revoked, previous_token_id chain recorded, replayed/revoked/expired tokens rejected (family revocation on reuse)." },
    { "id": "AC-6", "text": "POST /api/v1/auth/logout revokes the refresh session and is safe to retry (204 idempotent)." },
    { "id": "AC-7", "text": "GET /api/v1/users/me requires valid JWT and returns profile without password hash or token secrets." },
    { "id": "AC-8", "text": "JWT: signed HS256 tokens, sub=user UUID, role claim -> ROLE_* authority; short-lived configurable TTLs; secret from env (JWT_SECRET); stateless; LEARNER blocked 403 on /api/v1/admin/**; public GET /api/v1/events* stays open." },
    { "id": "AC-9", "text": "Safe admin bootstrap: AdminBootstrapRunner (local profile + app.seed.enabled, ADMIN_EMAIL/ADMIN_PASSWORD env, insert-only) + documented SQL fallback." },
    { "id": "AC-10", "text": "Tests cover the 15 required flows incl. registration/login/refresh-rotation/logout/role gating/public events; existing Historical Event tests stay green; unverifiable items reported NOT VERIFIED." },
    { "id": "AC-11", "text": "Docs updated: API_SPEC.md auth endpoints, backend-runbook.md auth config/bootstrap, no secrets committed." }
  ],
  "dependencies": ["TASK-0005"],
  "planPath": "plans/261015-2204-auth-implementation/plan.md",
  "evidenceRefs": [
    "dau-viet-backend/src/main/resources/db/migration/V2__users_and_auth.sql",
    "dau-viet-backend/src/main/resources/db/migration/V3__authoring_publishing_evidence_assets.sql",
    "dau-viet-backend/src/main/resources/db/migration/V4__learner_runtime_progress_rewards.sql",
    "dau-viet-backend/src/test/java/com/dauviet/FlywayMigrationIT.java",
    "dau-viet-backend/src/main/java/com/dauviet/auth/api/AuthController.java",
    "dau-viet-backend/src/main/java/com/dauviet/auth/application/AuthService.java",
    "dau-viet-backend/src/main/java/com/dauviet/auth/application/RefreshTokenService.java",
    "dau-viet-backend/src/main/java/com/dauviet/auth/application/RefreshTokenFamilyService.java",
    "dau-viet-backend/src/main/java/com/dauviet/security/jwt/JwtConfig.java",
    "dau-viet-backend/src/main/java/com/dauviet/security/jwt/JwtTokenService.java",
    "dau-viet-backend/src/main/java/com/dauviet/user/api/UserController.java",
    "dau-viet-backend/src/main/java/com/dauviet/auth/infrastructure/seed/AdminBootstrapRunner.java",
    "dau-viet-db/README.md"
  ],
  "reviewRefs": ["plans/reports/code-reviewer-261015-2204-task0007-auth.md"],
  "nextAction": "P1 fixed (c6bdb67): family revocation now commits via REQUIRES_NEW RefreshTokenFamilyService; test jwt-secret added for CI contextLoads. Await local mvnw verify (Docker up) then harness verify/finish on pwsh-7.",
  "baseCommit": "d1763c1",
  "inputFingerprint": null,
  "snapshot": null,
  "roleReports": [
    "plans/reports/tester-261015-0209-task0006-verify.md",
    "plans/reports/code-reviewer-261015-2204-task0007-auth.md"
  ],
  "blockedReason": null,
  "resumeFrom": null,
  "handoffRef": null,
  "acEvidence": {
    "AC-1": ["dau-viet-backend/src/main/resources/db/migration/V2__users_and_auth.sql", "dau-viet-backend/src/main/resources/db/migration/V3__authoring_publishing_evidence_assets.sql", "dau-viet-backend/src/main/resources/db/migration/V4__learner_runtime_progress_rewards.sql"],
    "AC-2": ["dau-viet-backend/src/test/java/com/dauviet/FlywayMigrationIT.java"],
    "AC-3": ["dau-viet-backend/src/main/java/com/dauviet/auth/application/AuthService.java", "dau-viet-backend/src/test/java/com/dauviet/auth/api/AuthControllerIT.java", "dau-viet-backend/src/test/java/com/dauviet/auth/application/AuthServiceTest.java"],
    "AC-4": ["dau-viet-backend/src/main/java/com/dauviet/auth/application/AuthService.java", "dau-viet-backend/src/test/java/com/dauviet/auth/application/AuthServiceTest.java"],
    "AC-5": ["dau-viet-backend/src/main/java/com/dauviet/auth/application/RefreshTokenService.java", "dau-viet-backend/src/test/java/com/dauviet/auth/AuthRefreshIT.java", "dau-viet-backend/src/test/java/com/dauviet/auth/application/RefreshTokenServiceTest.java"],
    "AC-6": ["dau-viet-backend/src/main/java/com/dauviet/auth/application/RefreshTokenService.java", "dau-viet-backend/src/test/java/com/dauviet/auth/AuthRefreshIT.java"],
    "AC-7": ["dau-viet-backend/src/main/java/com/dauviet/user/api/UserController.java", "dau-viet-backend/src/test/java/com/dauviet/user/api/UserControllerIT.java"],
    "AC-8": ["dau-viet-backend/src/main/java/com/dauviet/security/jwt/JwtConfig.java", "dau-viet-backend/src/main/java/com/dauviet/common/config/SecurityConfig.java", "dau-viet-backend/src/test/java/com/dauviet/admin/AdminPingIT.java", "dau-viet-backend/src/test/java/com/dauviet/security/jwt/JwtTokenServiceTest.java", "dau-viet-backend/src/test/java/com/dauviet/EventsPublicIT.java"],
    "AC-9": ["dau-viet-backend/src/main/java/com/dauviet/auth/infrastructure/seed/AdminBootstrapRunner.java", "docs/backend-runbook.md"],
    "AC-10": ["dau-viet-backend/src/test/java/com/dauviet/auth/api/AuthControllerIT.java", "dau-viet-backend/src/test/java/com/dauviet/auth/AuthRefreshIT.java", "dau-viet-backend/src/test/java/com/dauviet/auth/JwtExpiredIT.java", "dau-viet-backend/src/test/java/com/dauviet/auth/application/AuthServiceTest.java", "dau-viet-backend/src/test/java/com/dauviet/auth/application/RefreshTokenServiceTest.java", "dau-viet-backend/src/test/java/com/dauviet/security/jwt/JwtTokenServiceTest.java"],
    "AC-11": ["docs/API_SPEC.md", "docs/backend-runbook.md"]
  },
  "createdAt": "2026-10-15T03:00:00+07:00",
  "updatedAt": "2026-10-15T23:30:00+07:00"
}
