{
  "schemaVersion": 1,
  "id": "TASK-0009",
  "type": "feature",
  "risk": "high-risk",
  "status": "done",
  "goal": "Implement Lesson Builder Core in dau-viet-backend: structured draft_json (v1 schema) holding stages/activities/rules/transitions/evidence-refs, redesigned DraftValidator with SAVE+PUBLISH levels and per-ActivityType validator registry, sub-resource admin endpoints for stage/activity CRUD+reorder, Evidence admin CRUD with DRAFT→APPROVED→ARCHIVED lifecycle, and a publish-readiness POST /api/v1/admin/lessons/{id}/validate returning structured field-level errors. All mutations honour expectedRowVersion optimistic lock; all endpoints CONTENT_ADMIN.",
  "owner": "claude",
  "modules": ["backend"],
  "scope": [
    "dau-viet-backend/",
    "tasks/TASK-0009/",
    "docs/API_SPEC.md",
    "docs/DATABASE_DESIGN.md",
    "plans/261015-2315-task0009-lesson-builder/"
  ],
  "acceptanceCriteria": [
    { "id": "AC-1", "text": "Stage admin endpoints under /api/v1/admin/lessons/{id}/draft/stages: list, get, create (auto-id or client-supplied), PATCH (type+id immutable), DELETE (cascades activities and prunes nextStageIds/completion.requiredStageIds refs), PUT order with full orderedIds[]. All mutations validate SAVE-level DraftValidator, honour expectedRowVersion, return standard error envelope." },
    { "id": "AC-2", "text": "Activity admin endpoints nested under stages: list/get/create/patch/delete/reorder. Stage→activity allow-list enforced (e.g., MULTIPLE_CHOICE not allowed under CONTEXT) -> 422 STAGE_ACTIVITY_MISMATCH." },
    { "id": "AC-3", "text": "Type-aware config validation via ActivityConfigValidator registry bean: one validator per ActivityType (READ, VIEW_IMAGE, MULTIPLE_CHOICE, EXPLORE_MAP, EVIDENCE_SELECT, MATCHING, REASONING_CONNECT, HYPOTHESIS_CHOICE, DRAG_ORDER, VERIFICATION, CER, REFLECTION_PROMPT); unsupported type -> 422 UNSUPPORTED_ACTIVITY_TYPE." },
    { "id": "AC-4", "text": "Evidence admin endpoints /api/v1/admin/evidences: list (eventId+status+q+pagination), create (eventId+sourceTitle required, assetId optional existence-checked), get, patch (refused when ARCHIVED), approve (DRAFT->APPROVED), archive (refused with 409 EVIDENCE_IN_USE when referenced by published lesson_versions.snapshot_json). V6 migration adds evidences.row_version for optimistic lock." },
    { "id": "AC-5", "text": "Transition integrity: stages[].nextStageIds must reference existing stage IDs (422 UNKNOWN_STAGE_ID otherwise); self-loops and multi-stage cycles detected (422 CIRCULAR_TRANSITION); at least one reachable terminal stage at publish level." },
    { "id": "AC-6", "text": "Unique stable IDs enforced: stage IDs unique in stages[]; activity IDs unique within stage. Violations produce FieldError with path stages[i].activities[j].id and code DUPLICATE_ID." },
    { "id": "AC-7", "text": "Concurrent edits safe: stale expectedRowVersion -> 409 OPTIMISTIC_LOCK_CONFLICT on stage/activity/evidence mutations." },
    { "id": "AC-8", "text": "Incomplete drafts saveable: SAVE-level validation tolerates missing config/instruction/empty stages[]; structural violations (non-object, bad id shape, unknown type) still rejected." },
    { "id": "AC-9", "text": "Publish-readiness POST /api/v1/admin/lessons/{id}/validate returns 200 with {ready, errors[] with path+code+message, warnings[], summary{stages,activities,evidenceRefs}}; performs no mutation, no lesson_versions insert; centralQuestion+objectives+template.schemaVersion checked at lesson level." },
    { "id": "AC-10", "text": "Auth: all new endpoints require CONTENT_ADMIN; LEARNER -> 403; anonymous -> 401; public GET /api/v1/events* unchanged." },
    { "id": "AC-11", "text": "Tests + regression: ITs for stage/activity/evidence/validate endpoints and DraftValidatorTest unit suite (no Spring) green; existing AuthRefreshIT/AdminEventIT/AdminLessonIT/FlywayMigrationIT still pass; mvnw verify exit 0; no fake data or mocks to pass build; docs/API_SPEC + docs/DATABASE_DESIGN updated." }
  ],
  "dependencies": ["TASK-0008"],
  "planPath": "plans/261015-2315-task0009-lesson-builder/plan.md",
  "evidenceRefs": [
    "dau-viet-backend/src/main/java/com/dauviet/lesson/draft/DraftSchema.java",
    "dau-viet-backend/src/main/java/com/dauviet/lesson/draft/DraftValidator.java",
    "dau-viet-backend/src/main/java/com/dauviet/lesson/application/LessonDraftService.java",
    "dau-viet-backend/src/main/java/com/dauviet/lesson/application/EvidenceService.java",
    "dau-viet-backend/src/main/java/com/dauviet/lesson/application/LessonService.java",
    "dau-viet-backend/src/main/java/com/dauviet/lesson/api/AdminLessonDraftController.java",
    "dau-viet-backend/src/main/java/com/dauviet/lesson/api/AdminEvidenceController.java",
    "dau-viet-backend/src/main/resources/db/migration/V6__evidences_row_version.sql"
  ],
  "reviewRefs": ["plans/reports/code-reviewer-261016-task0009.md"],
  "nextAction": "Awaiting user authorization to push. TASK-0010 implements publish (lesson_versions snapshot + learner-safe preview).",
  "baseCommit": "47179b9",
  "inputFingerprint": null,
  "snapshot": null,
  "roleReports": ["plans/reports/planner-261015-2315-task0009.md"],
  "blockedReason": null,
  "resumeFrom": null,
  "handoffRef": null,
  "acEvidence": {
    "AC-1": ["dau-viet-backend/src/main/java/com/dauviet/lesson/api/AdminLessonDraftController.java", "dau-viet-backend/src/main/java/com/dauviet/lesson/application/LessonDraftService.java", "dau-viet-backend/src/test/java/com/dauviet/lesson/AdminLessonStageIT.java"],
    "AC-2": ["dau-viet-backend/src/main/java/com/dauviet/lesson/draft/DraftSchema.java#STAGE_ALLOWED_ACTIVITIES", "dau-viet-backend/src/test/java/com/dauviet/lesson/AdminLessonActivityIT.java"],
    "AC-3": ["dau-viet-backend/src/main/java/com/dauviet/lesson/draft/ActivityConfigValidator.java", "dau-viet-backend/src/main/java/com/dauviet/lesson/draft/validators/SimpleActivityValidators.java", "dau-viet-backend/src/main/java/com/dauviet/lesson/draft/validators/MultipleChoiceValidator.java", "dau-viet-backend/src/test/java/com/dauviet/lesson/draft/DraftValidatorTest.java"],
    "AC-4": ["dau-viet-backend/src/main/java/com/dauviet/lesson/api/AdminEvidenceController.java", "dau-viet-backend/src/main/java/com/dauviet/lesson/application/EvidenceService.java", "dau-viet-backend/src/main/resources/db/migration/V6__evidences_row_version.sql", "dau-viet-backend/src/test/java/com/dauviet/lesson/AdminEvidenceIT.java"],
    "AC-5": ["dau-viet-backend/src/main/java/com/dauviet/lesson/draft/DraftValidator.java", "dau-viet-backend/src/test/java/com/dauviet/lesson/AdminLessonStageIT.java", "dau-viet-backend/src/test/java/com/dauviet/lesson/draft/DraftValidatorTest.java"],
    "AC-6": ["dau-viet-backend/src/main/java/com/dauviet/lesson/draft/DraftValidator.java", "dau-viet-backend/src/test/java/com/dauviet/lesson/draft/DraftValidatorTest.java"],
    "AC-7": ["dau-viet-backend/src/main/java/com/dauviet/lesson/application/LessonDraftService.java#mutateDraft", "dau-viet-backend/src/main/java/com/dauviet/lesson/application/EvidenceService.java", "dau-viet-backend/src/test/java/com/dauviet/lesson/AdminEvidenceIT.java"],
    "AC-8": ["dau-viet-backend/src/main/java/com/dauviet/lesson/draft/ValidationLevel.java", "dau-viet-backend/src/test/java/com/dauviet/lesson/AdminLessonIT.java#updateDraft_saveLevelViolations_422WithFieldErrors"],
    "AC-9": ["dau-viet-backend/src/main/java/com/dauviet/lesson/application/LessonService.java#checkPublishReadiness", "dau-viet-backend/src/test/java/com/dauviet/lesson/AdminLessonValidateIT.java"],
    "AC-10": ["dau-viet-backend/src/main/java/com/dauviet/common/config/SecurityConfig.java", "dau-viet-backend/src/test/java/com/dauviet/lesson/AdminLessonStageIT.java", "dau-viet-backend/src/test/java/com/dauviet/lesson/AdminEvidenceIT.java"],
    "AC-11": ["dau-viet-backend/target/failsafe-reports", "dau-viet-backend/target/surefire-reports", "docs/API_SPEC.md", "docs/DATABASE_DESIGN.md"]
  },
  "createdAt": "2026-10-15T23:15:00+07:00",
  "updatedAt": "2026-10-16T00:05:00+07:00"
}
