{
  "schemaVersion": 1,
  "id": "TASK-0040",
  "type": "feature",
  "risk": "high-risk",
  "status": "done",
  "goal": "[ISLAND][UI/UX] Issue #50 — Đại tu toàn diện Đảo Di Sản giống hệt thiết kế mẫu 9 màn hình (Đảo Nhỏ / Đảo Vừa / Đảo Lớn, Bản đồ toàn cảnh 3 đảo, Đặt vật phẩm 2x2/1x1 & Mở rộng diện tích đảo 6x6 / 8x8 / 10x10 vừa mắt, hợp lý).",
  "owner": "claude",
  "modules": ["backend", "mobile", "admin"],
  "scope": [
    "dau-viet-backend/src/main/resources/db/migration/V61__overhaul_heritage_island_9_screens.sql",
    "dau-viet-backend/src/main/java/com/dauviet/island/application/IslandLayoutService.java",
    "dau-viet-backend/src/test/java/com/dauviet/island/IslandV51IT.java",
    "dau-viet-mobile/assets/island/",
    "dau-viet-mobile/lib/features/island/",
    "dau-viet-mobile/lib/features/rewards/data/mock_reward_repository.dart",
    "dau-viet-mobile/test/island/",
    "dau-viet-admin/src/features/island-builder/",
    "docs/PROJECT_OVERVIEW.md",
    "tasks/TASK-0040/",
    "plans/261030-issue-50-heritage-island-overhaul/"
  ],
  "acceptanceCriteria": [
    {
      "id": "AC-1",
      "text": "Đồ họa 2.5D & Bố cục Đảo Chính giống hệt ảnh mẫu: Giao diện Đảo Di Sản hiển thị thanh tab 3 cấp (Đảo Nhỏ, Đảo Vừa, Đảo Lớn), khung thoại Rùa đội nón lá ở phía trên đảo, khối đảo 2.5D sắc nét có cổ thụ/thác nước/cầu tàu thuyền gỗ, nút Bản đồ và khay Kho vật phẩm rút gọn ở đáy giống hệt thiết kế mẫu."
    },
    {
      "id": "AC-2",
      "text": "Diện tích Đảo & Lưới Ô To Hơn, Vừa Mắt & Hợp Lý: Khối đảo được phóng to cân đối trên màn hình di động; diện tích lưới ô mặt đảo được mở rộng lớn hơn ảnh mẫu (6x6 cho Đảo Nhỏ, 8x8 cho Đảo Vừa, 10x10 cho Đảo Lớn) và hỗ trợ đặt chuẩn xác cả công trình 2x2 lẫn vật phẩm 1x1."
    },
    {
      "id": "AC-3",
      "text": "Luồng Đặt Vật Phẩm Trực Tiếp & Cụm Nút Lưu / Thu hồi / Xoay: Chạm chọn vật phẩm hiển thị preview trên lưới với đế xanh lá + 3 nút tròn ✕ / ↻ / ✓ dưới chân vật phẩm + thẻ thông tin Đặt (2x2) ở đáy; khi quản lý đảo có cụm 3 nút nổi Lưu, Thu hồi, Xoay bên phải hoạt động mượt mà."
    },
    {
      "id": "AC-4",
      "text": "Bản đồ Toàn cảnh 3 Cấp Đảo: Nhấn nút Bản đồ mở màn hình toàn cảnh 3 đảo xếp dọc trên biển mây (Đảo Nhỏ - Đang sử dụng, 🔒 Đảo Vừa, 🔒 Đảo Lớn) kèm trạng thái và điều kiện mở khóa."
    },
    {
      "id": "AC-5",
      "text": "Đầy đủ 4 Modal / Sheet theo mẫu: Hoàn thiện đúng thiết kế cho 4 popup/sheet: KHO VẬT PHẨM (4 tab lọc), CHI TIẾT VẬT PHẨM (Kích thước: 2x2, ⭐ 50, nút Đặt lên đảo), NÂNG CẤP ĐẢO (sơ đồ chuyển đảo + 3 điều kiện tiến độ X/Y) và hộp thoại Chuyển đến Đảo Vừa? (Để sau / Chuyển ngay)."
    },
    {
      "id": "AC-6",
      "text": "Responsive & Tests: Chạy mượt trên các kích thước màn hình mobile, không lỗi overflow và pass toàn bộ bộ test liên quan."
    }
  ],
  "dependencies": ["TASK-0035", "TASK-0037"],
  "planPath": "plans/261030-issue-50-heritage-island-overhaul/plan.md",
  "evidenceRefs": [
    "plans/261030-issue-50-heritage-island-overhaul/plan.md",
    "tasks/TASK-0040/handoff.md"
  ],
  "reviewRefs": [
    "tasks/TASK-0040/handoff.md"
  ],
  "handoffRef": "tasks/TASK-0040/handoff.md",
  "acEvidence": {
    "AC-1": ["tasks/TASK-0040/handoff.md"],
    "AC-2": ["tasks/TASK-0040/handoff.md"],
    "AC-3": ["tasks/TASK-0040/handoff.md"],
    "AC-4": ["tasks/TASK-0040/handoff.md"],
    "AC-5": ["tasks/TASK-0040/handoff.md"],
    "AC-6": ["tasks/TASK-0040/handoff.md"]
  },
  "nextAction": "Chờ người dùng review và ủy quyền commit/push trên nhánh feat/issue-50-heritage-island-overhaul.",
  "createdAt": "2026-10-30T20:05:00+07:00",
  "updatedAt": "2026-10-30T20:52:00+07:00"
}
