{
  "schemaVersion": 1,
  "id": "TASK-0012",
  "type": "feature",
  "risk": "high-risk",
  "status": "done",
  "goal": "Complete the learner attempt lifecycle: resume-by-lesson (survives republish), persistent idempotency_records handling for submit/complete, atomic server-authoritative lesson completion with lesson_results persistence, learner progress/history/result APIs (owner-only, paginated, no answer keys), with comprehensive unit + Postgres Testcontainers coverage.",
  "owner": "claude",
  "modules": ["backend"],
  "scope": [
    "dau-viet-backend/",
    "tasks/TASK-0012/",
    "docs/API_SPEC.md",
    "docs/LEARNING_ENGINE_DESIGN.md",
    "docs/DATABASE_DESIGN.md",
    "plans/261016-0350-task0012-attempt-lifecycle-idempotency/"
  ],
  "acceptanceCriteria": [
    { "id": "AC-1", "text": "Resume resolves by lesson, not version: a learner with an IN_PROGRESS attempt on v1 gets that same attempt back after a v2 republish (resumed=true, pinned version unchanged); no second attempt is created. New attempt pins current published version only when no IN_PROGRESS attempt exists for that lesson." },
    { "id": "AC-2", "text": "Idempotency-Key persisted in idempotency_records scoped to (user, operation incl. attempt context, key): same key + same request fingerprint returns the stored response without re-evaluating or appending rows; same key + different payload -> 409 IDEMPOTENCY_CONFLICT; concurrent same-key requests cannot double-write; record committed in the same transaction as the operation." },
    { "id": "AC-3", "text": "POST /attempts/{id}/complete re-evaluates completion server-side: incomplete -> structured refusal (409, no status flip); complete -> atomic status COMPLETED + completed_at + exactly one lesson_results row; repeated/concurrent calls return the same result without duplicate rows." },
    { "id": "AC-4", "text": "Completed attempts are terminal: submits -> 409 (ATTEMPT_ALREADY_COMPLETED/ATTEMPT_NOT_IN_PROGRESS); GET reads still work; a new POST /lessons/{id}/attempts after completion creates a fresh attempt pinned to the then-current version." },
    { "id": "AC-5", "text": "GET /attempts/{id}/result returns persisted lesson_results (score, result_json, completed_at) for owned completed attempts; 404 RESULT_NOT_FOUND before completion; no hidden answer keys anywhere in the response." },
    { "id": "AC-6", "text": "Progress/history APIs: GET /me/attempts (or per-convention path) lists the learner's own attempts — current IN_PROGRESS resume info (attemptId, lessonId, versionId, cursor, progress) plus completed history — PageResponse envelope, owner-only; other users' attempts never appear." },
    { "id": "AC-7", "text": "Security: every new endpoint authenticated; ownership enforced on reads and writes; malformed JWT subject -> controlled 401 not 500; no learner API exposes DraftSchema.LEARNER_HIDDEN_KEYS (regression scan stays green)." },
    { "id": "AC-8", "text": "Transactional consistency: submit mutation + activity_attempts insert + idempotency record commit atomically; completion + lesson_results atomic; concurrent submits/completes serialize on the pessimistic attempt lock without duplicates; published snapshots untouched." },
    { "id": "AC-9", "text": "Tests per brief §9: start, resume (incl. after republish), completed-cannot-resume-in-progress, correct/incorrect submits, progress persistence after reload, retry exhaustion, optional submits, idempotent replay + conflict, concurrent duplicate submits + completes, premature/incomplete completion refusal, successful + duplicate completion, LessonResult integrity, ownership/history isolation, no answer-key leak; TASK-0007..0011 regressions stay green; mvnw verify exit 0." },
    { "id": "AC-10", "text": "Docs updated: API_SPEC (new endpoints, idempotency contract, retention, error codes), LEARNING_ENGINE_DESIGN §8/§13 (lifecycle/idempotency/completion decisions), DATABASE_DESIGN if schema touched, task.json acEvidence." }
  ],
  "dependencies": ["TASK-0011"],
  "planPath": "plans/261016-0350-task0012-attempt-lifecycle-idempotency/plan.md",
  "evidenceRefs": [
    "mvnw verify 2026-10-16: 148 unit + 147 Testcontainers IT, 0 failures, BUILD SUCCESS",
    "ResumeAndHistoryIT (4): resume-after-republish keeps v1 attempt pinned, no second attempt; /me/attempts paged + owner-only; /me/progress resume surface; progress reloaded from DB",
    "IdempotencyIT (6): same-key replay (no duplicate row), different-payload 409 IDEMPOTENCY_CONFLICT, scope per operation/user, concurrent same-key never double-writes, no-key passthrough, failed submit does not burn key",
    "AttemptCompletionIT (6): premature complete 409 ATTEMPT_NOT_COMPLETE, success flips once + lesson_results row (score 100.00), repeat returns stored result, concurrent completes serialize to one row, submit-on-completed 409 ATTEMPT_ALREADY_COMPLETED, /result owner+timing",
    "MalformedSubjectIT (2) + JwtSubjectExtractorTest (4): malformed JWT sub -> 401 not 500 on every endpoint",
    "IdempotencyServiceTest (5): SHA-256 fingerprint stable, canonical sorted-fields at every depth, attempt-scoped hash",
    "docs/API_SPEC.md, docs/LEARNING_ENGINE_DESIGN.md §13-TASK-0012, docs/DATABASE_DESIGN.md updated",
    "code-reviewer (agent): no blockers; should-fix items addressed — concurrent start race -> resume-winner (TransactionTemplate fresh tx, LearnerAttemptConcurrencyIT.concurrentStart_singleAttempt), cross-attempt same-key claim -> 409 IDEMPOTENCY_CONFLICT, key>160 -> 409, HiddenKeyLeakIT extended to /result + /me/attempts + /me/progress, myProgress bounded at 50",
    "mvnw verify after review fixes 2026-10-16: 148 unit + 148 Testcontainers IT, 0 failures, BUILD SUCCESS",
    "final review follow-up 2026-10-16: pg_advisory_xact_lock(hashtextextended(userId|lessonId)) serializes check+insert per (user,lesson) — cross-version race CLOSED without breaking version pinning; CrossVersionStartRaceIT (2, deterministic: republish between starts + 4-thread mid-race) proves exactly one IN_PROGRESS; score documented as completion percentage (not assessment) in LessonResult/scoreOf/API_SPEC/LEARNING_ENGINE_DESIGN",
    "mvnw verify final 2026-10-16: 148 unit + 150 Testcontainers IT, 0 failures, BUILD SUCCESS",
    "P1 review 2026-10-16: empty completion:{} early-complete CLOSED — evaluator no-clause config falls back to DEFAULT_ALL_REQUIRED (was complete=true with 0 done); DraftValidator PUBLISH rejects completion:{} (EMPTY_COMPLETION); AttemptCompletionIT.emptyCompletionConfig proves 409 after start on legacy {} snapshot + completes correctly after required work; stage.required vs activity.required semantics logged as open BA question (LEARNING_ENGINE_DESIGN §14)",
    "mvnw verify after P1 fix 2026-10-16: 151 unit + 151 Testcontainers IT, 0 failures, BUILD SUCCESS",
    "semantics review 2026-10-16: stage.required vs activity.required RESOLVED per BA — optional stage makes its activities optional for progress/completion/cursor (SnapshotModel.requiredActivities stage-gated); requiredStageIds explicit clause still overrides via requiredFlaggedActivities; DraftValidator PUBLISH rejects REQUIRED_IN_OPTIONAL_STAGE; AttemptCompletionIT.optionalStage_neverGatesCompletionOrCursor end-to-end green; LEARNING_ENGINE_DESIGN §13/§14 updated",
    "mvnw verify after semantics fix 2026-10-16: 155 unit + 152 Testcontainers IT, 0 failures, BUILD SUCCESS"
  ],
  "reviewRefs": ["code-reviewer agent report 2026-10-16: ship-ready, no blockers; all should-fix items resolved and re-verified green", "P1 findings 2026-10-16: completion:{} early-complete FIXED + regression IT; stage/activity required-flag semantics RESOLVED 2026-10-16 per BA (optional stage = optional activities; requiredStageIds override preserved; REQUIRED_IN_OPTIONAL_STAGE publish guard)"],
  "nextAction": "Commit (auto-commit rule); no push without permission.",
  "baseCommit": "a9f6df8",
  "inputFingerprint": null,
  "snapshot": null,
  "roleReports": [],
  "blockedReason": null,
  "resumeFrom": null,
  "handoffRef": null,
  "createdAt": "2026-10-16T03:48:00+07:00",
  "updatedAt": "2026-10-16T04:55:00+07:00"
}
